{
  "format": "haoxiguan-backup",
  "formatVersion": 1,
  "appVersion": "1.2.0",
  "encrypted": true,
  "crypto": {
    "suite": "argon2id-xchacha20poly1305-v1",
    "salt": "vwzgAAA7XKAN5gfCZs/rmQ==",
    "kdfParams": {
      "memoryKiB": 65536,
      "iterations": 3,
      "parallelism": 1
    },
    "nonce": "h8cPUv1pamYbOuos2zo/JCGYkYVy+z1n"
  },
  "payload": "PLHQefS/CvQqiW1rwnXT1DBUZpQLqddP5Ladd/FDquCt2Dapl8r7XUNKETESxiBhRAedZ8F2ZGOYzC87tigqdb9cGWdFp7kEyJugfFHlzCwjI5OGz3bKrh3sUesRvnCGzakRsL/GF1sbpl4rAYLmviN0ig0VMkAv5Hm/R4JhOxWVi9/tGtOsSWb/vcMUoe1QtLHXuvSaPN3k3UQILBnHcI5+q9Vs+Vg6mgk1H8FJNjF2s863Epi8a+ZYx5EJD/OQ7upqsi2dds02ULdsSJoLoM7WmeEAHUwYsuDWFmbVqovTMC8a3F+NuqP9d8l7kKEPyxTIti1jX9A6jp3mywtO7RnEjAEfoAbThIujaEUGL6WJmtO6ycmnT3/u33YEmdqdhsYKH0An1LSqXLumPaqnqcWzT6CptDWHuQxV+1MFuQwUc+YzArPehsAMW2272/AdrOuV/Ec0NfiEW8y0YMQIAkzNAmNInQCqvE4BwQPq3IM45mhv1343+bIHNrdU9AgFGv1nixEKLW/KzHR8MT1KWCDIZD4eR1KiIE8mYvfFTqeRNoPJV9uKyjUOXGVxjfB4p+Z3lLX+n5xNVo+3zfBPWq+XGSiCHW0UeSPV68npjASTddBvR8fIsrYKUpvwkbnmRGnSMjlTZO0jUyQztcfALnDPGT8mqoz9d2S9uoDuRP/NmJ50pS2Azaef8+t3o/r7VNjs1ePYUxVOTIJpFu3FFnDk/ds+ZiBTXfGRydlN5LMwBz7AxFABILyecJ8TfjVrY7csW2Wt2ulOJsF2T/0glZll7OJPjKf+Igt61QxSXxJd9EqtjIEAF7G+h4C33dqcAy3lMnKBI8cNlmz+60gORm7yTARByVkpkpamFFnHniYOfGsSnnUqboFXHIR8unHP1+kyTdyB1vdtXhyqNUx7ic76Ou/mPLGQ6JmcIWggOi6Btu6aWnsrYZaMfr/gM3LDgI1jYue7AiDvMsH/0Y26MshiM/RrTNaMaZEmPM3TJCmfm9Qo40Z1mGP4w+b+3uACo4rZgJkEHmI9/oNe1mrff8IdyuMwRUKimmg0vELBCJ8ZOkxaNAkafV8jA1IOP4EnItDmv4EMjj5RUp+WvG4rnJfuLK6LhTtdKzD1f25jhuJchMtLK9GExbpaYYQ58IOkcCRzTG4i99261lM1WmmCebdGUxboaoWDuYDZO8kZHtfjyhS/BUh1zIL6+TWK+7AOxoFHfKJnOgVoJ8psmd0luvv1j9J6f3xOAQd3IuW6SBTtglQEZg2vONXucZNgKaeFK1mpkxrGDV8ELc5hmKUGL8xlLiKCKj1+EbRctx+COleyJBfns6Ge78a4xOqCN0BmVJusOYYuYQWAsacxwn5YwvYimcgT+8N4ypqQkznLw4lTmlMOES8e4jyBMdchC0S9IM9zKFswdQt2brks5IFlx91ivmeaVlyXf8XydCcLztNKphT/K1qk9hbMtKsJXRuXh156KkjR3eU2ugzeD6dUitIPMVpdZtb+DH8pVSW52/75D4mF2x0SNVz2jAfkil5YXkG2yR7UuZQB+HmCjUN2hbQoXLphkgO/HOfRCF7HKU0TLlGbM8SnySnSyL0HQkFg0cOhDTI7e24nIaYCkE+4sIRLLwxBAsbcF0U1X8jsF6XWiLURpJzfsK5wa5GmCemGKbzeCkYhshvhZu+Ci9ZK3YkaaQBgB4+DRaYV0qJGo5+AUX0LkIDkCMm7VuAT8ODGmXLZJGfJQjhJroxog0feTSuT0LnryZaqmVnZd1hHOG8Iu43BWoVHUad6yYDBHwJkMf6vxmoqBnDajmBVxiGCrZWtrd8Qqvw+KDSy6AZyvX6stmlsZpH4H0iW0eyFq0ESttJfHBcEpcPufnb3214mr53tjeK+7uFC0YhXITP2qYeIxHjoqggdD9QudN5tHLX4rVCyQs4uQ+gas2yDxqx9cBUY0mhLPB1eEIbu4+XU9rGN7kJEAOAg1XPiZ/t8dUTPWt6G/WKKtW88rn1+ikRHHrMxC9OikyL0a8urR/C5bJJ/5xwC//YO5SUgdCsAs5/ftl13uBG1usPFPd0tsM0ojm+W49D2tSkQxYTYpHC2s2hXA7INd2Qcp97PfTR9LEWAuMEWYjY4odoAX5ZmKYpZ22Xn9wvH0Fl+lMqpmo5fE8bHQTLSJtiSzGG0koK+uAz8zCewJrTE1kkSUFhkc0Xe4/LwcHNNMBF0pz68xsAnXfDkrXGQEMoOko6/TpEHX+gdbxHDn+UQfKBlG0PAVarkTX79Z+gNgxMlNKgqkNmyP4waD+UNf6sRiwsi1fmH8KivkX2lMiNOxUnq76QHgzK/5edhJkxLyxPcG5BkcZetKdvYCSpOBqAe2f5aHs1BmgSGJdJHhK0/5qKNpi8S8ldqepuwl0O7vsIuXgS5h549ZIhgv9+HfzWF5wEIURtoywrFV+ozbDnkY8pAd3RefLHp0A+cLrVcG990/AETzejK13vAkf/HWHvBzr0kZS4BKg81EQc+ze1X/KzT4mkz8fcPHbvvi1c+OOGAcIw/BIQudO/MslbdjnM/QHhIKmzbInZykYnGWKlTQU+eofRzgYbwMELKabuq+ZzW7YQcZFsDtFwZt1IqeHqWn6EqZJ3AYBhQZl5Rzd9fuItG7gjCbzmUxBm5jaGnljcHEIdzzEiG2lGqHK4sVAOwH4bOWEgtJ+4+cTwgGlZigcg96lDkeM4mCLJh7UhtsrP9JlRv5DOuvNjF34nEjD6jvr7OrjpZdoltFwmp2Nna2EtURhNvQoEvB5Yy/1XHwjjw5hlt4nzPuEyMtdFgZlXRY6lSrgsHfH0p8wrcG2KNvDXTj/J7pMnrEWpoVTQS8XBrZ/Dh/haNmtiqApbnzTeRYuVUY/ELIQN1zCU2fgBnN+Gx0g3hjYyqknSAaMizC3PIckZQvGdiOVoYs61+GNWLKBErEmtrcVO7tTqKK2nnyu6cRQlMHLQWpeEjgFYvaFS2V0rhOGBtYaWUvjjx5Qz58XvoIkzOdo3oIj2eiepEfPMO9GvWbPjhj04p3aUneYJVkv963hixCbOOH4RVAW5ts+cQnuxdI4kSPS08gcZN0crUshwbeFKl7O0yQUfHPxxrz3oTJ2bKpjSIcu+pff6kReekooDCAjjZi5QB+upRKeu7Vit/nxtZlXxnIv0Z3G21OXfTPbdM86uDbwHIaHR38zHJd6Zw+PkKoMttZaywKhKbMLmzvTesbFLW8hONx7PRIb02kz8khdC3JTaQ0IEfe0f81F9Nz9HSKn/DrmlzWNo8DmCJa0ZIYVZIbjs0zEVNfNUNKUnQM+R1Z8poM52da9mbaBWn4hz/MN9ddH4HlJfQaVNbsrp8Q4SeVZkh6mjP1PsJBW53GhcqV7S3vai2bcoIVW2gcKhPECPYMlzYBs/Y/TP3hiZhZMqWGOtQje2qZLYUK2YiFZ2DiHMxnV0mI63IUtEe9IgRSgYOTUuzU45riFBUCiofKnDP7vd7wf0nQBhTO9tXHQHO0QOZmkFLFOmtU9OxOT06l5UYAplB/MdI0CHrEMqjQsGL4CTlfdCPDeglLvh0a3+oqbQtQnFCBWxeDv5BLVubQEO4jj9fnEdQerajSKsq7cskHv/+I3Ft9nYM5MwTQqF7I6YmKJR/Bb2CeJ4D4FP/aKOwyRiwJ5GGS9PvnkKN47B5YlOlj1A/MjdWyG4EsqlB2ZzZhHtJPqk3et9qJCTUEUDuslZ69O8ofXQ+aMHWBYGyjhC0P3Ha//urUCvNnsfbiwnuzPfprAW140u/szFCbmx/QaujdnTvivybwIhCO8wFryo+h5uMIa5fLOMNifC6Nc6OuaQAdzvlzoWZs6BNdeoImwAAueQI3GoG0mZBmVvzvdSDcDTJKYXTHduJkcYCdNvXb+BTbS7SyyvQQ5nWFNMP7SnMSP+grTaS5LkcO0QuyWj1VoU1Cf29750NGHOvySM8TDtuaMlVOxgOHbyZfXIsn1uBYbFu2cWG0Qi1NR61Qq6Bp+K30mbCLYtB1NMU2MWvk8iTzz1SI0vZZ5gCOJaxmblBnKzIFb5ejsEdEh+hjxYOy5HmoXWlyoRZcX7SF8AG1sjvO12umz7FvkC/nFDfpethS8J9kvwUSoK+G2+ISgzdO5saTcQ4Np5pzBd3FTogroI5BaQm5bBq5qvF2DXDVJsGCA6GMIqSXoQgFutdhmZW+sxLzKPx3enFJULaHBX3lEP4/s7Ln2WvPAqRtfdzTqBY+2AXO9TmVuaWre9oR3OUOFdf+HHIJJC494cksCu2jJNg2QmrFKsyISaqz3APXWKMygnrYgz7vHzaRS71tEBBmZTgrCQ23LlaryI3IpHgUI8IzTulRWeCn2Ev7+p5o0JZMD506O2zVydm3d+6V0A+PZpZhiJBvtkfVl1sDDMgvhMHMeHCcoe/Wpu4ABVIcnEf7mwqbPPIUYZ+raIMPIZj6kQW7m9zNrmmcqjNljLEadKC6A3sOBllaqya5cSj4+c8gwrcBLKyFPC0+jLBZYjkopZjkh2L8fgOIboKc17Au1TiOuxi29P2+gGm2GTksxPX6naNIPC7Ey+dIz5EAnjqnLPwnZwi4IOwGR5zeydpogUZpdnO+ViLgdXxAE7yZjVN9MSFO2WIn+xfuJ2KOQNs8VcUAgRlWQBnKFjvV9qAxpW0yCeMDlAiTU0fFEytM2wue0ssV2EA0xDIXuOd835TSkn/l6EIgWA5IWkjLhNv5kJ/ghpeODFdIIZP0C+b45XNWPv1E3SB0+1QLYf9evOJaBhlZIYFOJieVugwmoPLoIog5LWMkEuaJd/uYhgZ1I8PeaxOq7U3qeoLKNKIoVQHoLPPm9ODM7sj8pW8oijlxontmBrDHJ4VXVXb5Xb7cDG+I1AJZCWNyP8RTiJu6YZpRidYNwfbS6BNK+n378r2gXbNdQ3htVbfOX2FLMCYkzfVsZswHW3J7ci8JDDXnjK4EZ5D7XuMSXusap5MhDVDzw5MCKNQc5C2pltm9Jvmgvavm0hyqc5A/iSn+tuPgBUStF12O9JJcDla9aTZIwG5dBobdxcB8tc4otuHwjZ/ddS9nia5BLKuxD32ySZiOplXhlksKw1Nw6bBMBVOXczGiJiACuzVlv83TbR6U6bzHnrlV2GpNTWY9cOE8W2BKtcLXlOzLUwuhwlyY2NjkcnbSB53crlivG2385DEoigbxrWsSuIJf9ELcZi6P6LzyyKZeBE4YTeGOIIyxSsMTixAngNs9I+CNENi/f9JBDfgavycB5rvTBBoBGKoDdua8G6IAYD8+p7eMr4kfOwp6YifMvL5EiRE+d1ulxd0ir59DwzQigU+wliF2YzfbWhD7sKlsLPlrot5CXFex+aKHCRlsvQJ8fuH01qPugu+QEMZROxLkvSfv2ND/kr9wDAk7CLZu6SRwx1swbzOJHpYynGYY3ELKUTomk/eOXn/QxFJo9FZQFNQLvP8dWZ6nxX+b9DBgDz8mYrdwkmu91vQxBIM2Ca+Mb57g9cok8EYQA5aMRHCHCInsmEXFj0CA4D/qRecKLhC2fXguI3/CQOh/mzM+M+pI7RJACrdO+eZSCMuyxb4SMy6PxrbAin5KQKPxW0LBjEIBZcPhC/uqFFQP3IK2jRamMmg50CbXaKPRX22XsWsQW9rrgJ3KVVBgh3S6fPgnLDLEmO2vqaIT65Hbw2aMo8Y60XLAL+pIq0c4Nu9Ld/syAZ2KCfnkDXHZ0cKcFFG2/dY6JS62dYx2vG+DgvRC0UhTcUGiaTTCNdo8jHs0K7liwkzXb8bQCthrwDzvHurM3h13YO3m/jnO0eIYNL/K6/E7nuRLtwnIsoOMTbhA1UvBIInpRizY39y3grub0JzSQiRqrUw2+7QnO1L9Ftt/ri+Z0vflXtGAbuR72SQNOgmxUybs6MpSx9ozp8Cp/f9pMsjl0DVzP+i8aqQlsIhjR8GuQ92KyswBSJsFzFIs6sA1gHlAEWD4W8mpjS5r0eLJ0v3njcY7Y/BbWkuyEW1K5P5zcn+5JwjNdG2WsG/H6suc/evy8bp56+J5qdTYdgb0FxrYsSk6/TsFq1UOfkwJMSxEh5Zvtw6aw0KgcrKM2QX1kG0PSsGEo4juH4ZQi2I/H0iltZByOP6ihvaF8swZbwDerL2gJvUA+GNXD0Wa/GJkTDW9kvCkPEHfQA1Y9Je0b0TWCbOQTEveUFnUj/rp51l+MWvmzMX6rBWFFTihrTNmxtKsqEfoMFOpaQxAb7Y79+XPN/Hqt4unYYyCLJk2Y1eBuUBbHfRh7LyciwswB5bAS2lE084weUZ+v2cpLku1FDTfFIwqWetnec566KMdnO9iSj3KvCyPkL6zFm5kFX61qOa7oTOIaFonMmwYx9q9rWKwQdLtjKTmyy08LsFy1VbNiB2/9p5QbVgdcCDAtg8qSHIVCnDccrMJhuOQgZBotBEvTSzSc5qg4P+6QFnWuu5nQ+X14sPtPA2usJIaH2BpfSo64f1Y3wJM5gjF5YSOt0COikzG4/8p9ZYcp9ehapIxvy6gkXM2a/MhRmfMtu/sj4DxHxfKISr5YU35ah1KiUiW6Tn1H/A655xCOiYTzDxYzprhvvs5dHXzVXqLm5C0TafjEwRangb2FiTRGX13Gie3oHvZd6saCWT98ZhZFEgOtolvZlkGb1nF9tVKcLOxoSwl0LIHnote1AvlYI+VpQvnyy4iMWrTBV327gZYqBUCXXfEWdIf1ATbmQIdMTHVfrF4I1MkGuOZ2tihtCPF9CV5YXKwJcCXmiN8k4BaEsT2cZTGTteK2tp8p1myEHLlfk/DFzyXSgnM1g/Az7Hy7225PBrvKbdQCNsPU1ZKXrLhOkfd+b4B8o2p/Lg0VqH+bg3sS0rBiLxr6nboXJgRP0JC+FE9x8fHqZfBY9JOrYokGiddO5f35qZWjfLIXXtP1j8tUlHSDyKYxqy2g5rC01ZcxDTEsahwEHMQThtt56pVt/Vj6y0wHUk2UDpzgAGB+KtyTlVXWW6Ecv8/8rjj4497koypQ4MFlcQGqoObNUyguS/Dovp+gbFerxvW3pJ2BCpwWMC76FgFjzcC32Z1gduNTLonIbxZkEeucBjMqOTNRmK9xRFEcPmih6QWXZQN9/FcZNaVkJTLqAQZMyHDPutqFP9TPpvkJ+wOHJLd5eBTCO06oeQbiKNwN/yjv+XQEMPqVK4/W031Bn6tgXd87dx/St7DiePLncZv5Rf3Ma82owmT7AYtLt9GkxFeCF/d/MnLHwXeidFa27Z3ViA9thRJaY85y3kYAIeXmoRuTxpmSdjBCODox0j49rbMPyd/hS87iAz7HLHGtX7wi08xysU9MatohDobEMxK7qZcEPVLSk1rgF4r3DizWG4FDeUnZBAluyzY/If9ZT3rt7X4BC/mMgWapnST3EZAfbG1fDJLZHrlll2y7gb9+7nKkE78YhFZcSkX3jM/O/RP3wUPQpmHoPf/8q5TagYA/7IaqyP7k3PW/PCYUSICAJBj+EoNwkkqLG8523/+3pvgMHUVT0rrym6u29om3haKQNcc6nVILnD+wZfi9XKjI70h2xWgA8j38aGGEWz6RQ5dLz+lEmbyJo1CWC0uf5cqbfZOTa8YDeaUBD3tvtr2OpiqFcp3AWsukHeAIAe6/WVauBdQLZDTD4Lr9HwuvGeG59iJJ/rLfeg2w98GW08L3m1a9ERpWTnx526tVMa4agbkc8mvaw0wQwPzpD9v09zJfomg1W3QLwME8vlEX8Vu2z1QBjziGxkxE0jIjgci6usfRPLJuvaEpYrPqoOnHBLaV0psH3l6j6wTr76SBs0MRzHJe9v+TkHTYL8rhKwT+MBFC2OiKIJ7HUb+jmBOMDD8vPCbiQSZHw/yGfP/Bxbauz2NSYzJdEf6oJJimgCKw6ba6ndvHm2KDmJhtY+vVWorS4T4Q1CKYXliXq4dyAlOHgAuBjkZsrMo6CbDMEblw+SFxnMDZXcZf68DtMjXQSRCoKm/8JZ/w05eYscN2zUsMrQVyfEqp0YxwDt8AwXVT3o6htTabSLPl5gL/PABWbddndDkHKYYkqTneEHwX4WDzgjYUl0YpSMIeKEFyoyXsqIIxgm1GkhK5PUgA2M70xzllfcwblNxZQUcsaSY+SbhkbEELWexbt5G7hHD7d+yQeHN6sRWrjKVnOGitjAmp+iFfjY+35Xux4lCBGdG+vU4W6bYiGmdDuqYGDrW5qtJkFXmRdaCwAIDMPU3WX3S2WA3LrXQOIjmFeAmoFFfu9tEgSA3nNXzZcECb2l+gf4NCOXe5yCMp2NDY7TMDQdaDS6jvCV/YZfxloT+KWNoRcJ+E9KPR1dse9ELwp2cfxygAsKhCaNBTcjnHSXtYFSILGSAJUCa8FBlIpRXIEmHNzm7NmAIa41ZRZ4x8d5sxHTvox8vnLN9D48VfMYXyFpnwmSIcT5SbvCBqSH+6Qc6N0eZ1ALOXvvbQVNji24IT3ObD+msurCeoAaAvFLNlh/zCGGMETY7cYCLs8e4EO5llgmCppN0CQydjxWvco5tyYaRB7ze0hk9RwxYt5YtkKLAG8rTICZPVFr8m78lWrfFyDd5EfFmioofOQsoUVQE/zpZI7/vyFG+aaRwzzK6ctWuXdXVOID9QClRI6gXMl5AGzpl+oQ1xewjSs6hp/jLpT1kw1Zsq0uV7CFIGerIIdZ8I/HXjQfVEBEYbL/8CMzb0cs2NY6fjK3+E0HKJaq3qNw9T0roHuQRywg5DpWtBESho772MmHH9faoHx2jCIISuA7l8Gl8VsAPHbk/ZU8W1Wz1XSxynTbLfUwAgj6YfWfbDIU2tQZS2gYjckdboVYSFPLYrdxhNn1qsjG5p+zm/MgF/34+EE0G2iPs7LBYSw0n/XgtD8WE8XUECzqxZvzlED5NGwP2A42dPTk6qVf2KcSMUNDDHo0jrI7lvaItNF8yZCmXzHGUKLTGD45c844G0KlINDupZetmIrhgdbUwc03A8Lz+R3rd2tlIksKUMILqC52p1ktAHO9/zBCHUhK+J2hhCT3AgZHCgtFeiwu09sRd+sRS21+1LUaXZY6HxlW1dJfHtBb3h7djS2DF7rRCbV/8xlYCxF78p5diKKiBxuSCB2+UdsV5lhQS8BgxQzYnK614is7cbfW+G9HCF/qN6jNYTzpK5ZeCR+lWHv0v1dvT2Ubfyo57bZ0bHeA0fZcXiZkYESwErLFrlrlYTMc/GP9I+WvTIRvD73X6j97056nj0QgK0aDre+MZ3VOisvl2sOZivlDAAt/hJ8i56vWc4r9D+5hZ94U7q3ACLSQVtVwR7t+oXLIdful7fhIZcZ8CND4Lgpfcon+MyWTzqIs/xwTa0C3fKFhbgkFZKq+XbadwucteJe90e8PDRNZ2c93ZlytsF2Juf+2NxMpZ7UqBju80TdQFuuEXnK8ul6+h4Ei7VOXWoU0CuUlWru7psjMeeiK+GhftpSfWahbYvwJTPo3eFkJq11NdwOfmH6e6+R0ln9+HlfLUD2ItUwNTURxeKXRaHWBA/boU++lWed5WqSEweLalJOAtrQwlL+ILzAfuNnziTiHhgPbk3j2IkluzlzcihKsPJ0PcZZ2eB+zkP0YmvmeM9w5D7/zNq1cXmnIAAel9FW0309Dc